{
  "review_id": "fictional-correction",
  "proposal_sha256": "79a16dc76881c65d8ac095631c53f433e12a5c0b69a2d5e3524c978ca67247fb",
  "reviewed_by": "Jules Elm (scripted fictional example)",
  "omissions": [],
  "decisions": [
    {
      "key": "evidence_atoms/E_QUEUE_VISIBILITY",
      "fingerprint": "9a902ef1c5985c7ea7b9f8ea3dd84bc5f24ef6f7b03f8dd1d0e8a83680873d40",
      "action": "accept",
      "publication": "unchanged",
      "note": ""
    },
    {
      "key": "evidence_atoms/E_REVIEW_SPEED",
      "fingerprint": "43fa9716f0640bd4cdcb1023da9b6a4ae4b962d5e9f92b4f91ac6a9bdc8c4c22",
      "action": "unsure",
      "publication": "private",
      "note": "I cannot recover the baseline or period. Keep the 35% estimate out of the accepted record."
    },
    {
      "key": "evidence_atoms/E_STORY_2",
      "fingerprint": "7a52bf05e90140af0fa5243a23bb6b5c3a30f272fc932c2b805bda54724e6dec",
      "action": "accept",
      "publication": "unchanged",
      "note": ""
    },
    {
      "key": "positioning_preferences/P_DIRECTION",
      "fingerprint": "498016121bf82a983b0faf1ab47fd6611b5c0a536e30ce4cd243cf9076910095",
      "action": "accept",
      "publication": "unchanged",
      "note": ""
    },
    {
      "key": "source_records/SRC_ANSWERS",
      "fingerprint": "803a53796cc02891aac03ce78a627f8ccb61ce7b8872b2000347e848546c4797",
      "action": "accept",
      "publication": "unchanged",
      "note": ""
    },
    {
      "key": "source_records/SRC_NOTES",
      "fingerprint": "c0e2277523b43de078155b81480cda312bf951628e77ed5b51f45149bbd7f486",
      "action": "accept",
      "publication": "unchanged",
      "note": ""
    },
    {
      "key": "source_records/SRC_SUBJECT",
      "fingerprint": "6a5247de72175290530256992da7c1e734f6fde4e02cab749d8421094384689f",
      "action": "accept",
      "publication": "unchanged",
      "note": ""
    },
    {
      "key": "strengths_profile/S_DISTINCTIVE",
      "fingerprint": "b8477fdb7caa9af66a55e1deda62f750f65bd7ce36fc59f94232d06083d392fb",
      "action": "accept",
      "publication": "unchanged",
      "note": ""
    },
    {
      "key": "strengths_profile/S_ENTERPRISE",
      "fingerprint": "55d88c968dba170f67bcb3b4409494402cf25ff277a6935bc396a1b72dd8a30f",
      "action": "correct",
      "publication": "private",
      "note": "Enterprise-scale transformation overstates my remit. I lead a focused group and work through others."
    },
    {
      "key": "strengths_profile/S_TRANSLATION",
      "fingerprint": "68d0cf05c042c639e99513792bfc534bffaa0a276ac188f98521cc3e701fee15",
      "action": "later",
      "publication": "unchanged",
      "note": "I want to revisit the wording after reading the examples."
    }
  ]
}
